[
  {
    "schema_version": "1.2.0",
    "claim_id": "claim:snake_plant:lighting:001",
    "plant_id": "plant:snake_plant",
    "plant_name": "Snake Plant",
    "scientific_name": "Dracaena trifasciata",
    "entity_scope": "species",
    "dimension": "lighting",
    "qualifiers": {},
    "claim_text": "Place where direct sun is limited to 2 to 6 hours per day; the plant also tolerates very low light.",
    "source_id": "ncsu:dracaena-trifasciata",
    "source_title": "Dracaena trifasciata",
    "source_type": "extension",
    "authority_for": [
      "horticultural_care"
    ],
    "locator": {
      "url": "https://plants.ces.ncsu.edu/plants/dracaena-trifasciata/",
      "section": "Description",
      "paragraph": "Description paragraph 2"
    },
    "review_status": "human_verified",
    "accessed_at": "2026-08-12",
    "review_notes": "Revised after human rejection to restore the source's actionable 2-to-6-hour range; human re-approved."
  },
  {
    "schema_version": "1.2.0",
    "claim_id": "claim:snake_plant:watering:001",
    "plant_id": "plant:snake_plant",
    "plant_name": "Snake Plant",
    "scientific_name": "Dracaena trifasciata",
    "entity_scope": "species",
    "dimension": "watering",
    "qualifiers": {
      "season": "spring_to_autumn"
    },
    "claim_text": "From spring through autumn, let the soil dry between waterings.",
    "source_id": "ncsu:dracaena-trifasciata",
    "source_title": "Dracaena trifasciata",
    "source_type": "extension",
    "authority_for": [
      "horticultural_care"
    ],
    "locator": {
      "url": "https://plants.ces.ncsu.edu/plants/dracaena-trifasciata/",
      "section": "Description",
      "paragraph": "Description paragraph 2"
    },
    "review_status": "human_verified",
    "accessed_at": "2026-08-12",
    "review_notes": "Removed the season-free overwatering rule from this seasonal claim; human re-approved."
  },
  {
    "schema_version": "1.2.0",
    "claim_id": "claim:snake_plant:watering:002",
    "plant_id": "plant:snake_plant",
    "plant_name": "Snake Plant",
    "scientific_name": "Dracaena trifasciata",
    "entity_scope": "species",
    "dimension": "watering",
    "qualifiers": {
      "season": "winter"
    },
    "claim_text": "In winter, water only every one to two months.",
    "source_id": "ncsu:dracaena-trifasciata",
    "source_title": "Dracaena trifasciata",
    "source_type": "extension",
    "authority_for": [
      "horticultural_care"
    ],
    "locator": {
      "url": "https://plants.ces.ncsu.edu/plants/dracaena-trifasciata/",
      "section": "Description",
      "paragraph": "Description paragraph 2"
    },
    "review_status": "human_verified",
    "accessed_at": "2026-08-12",
    "review_notes": "Locator should be Description paragraph 2. Wording is near-verbatim from source."
  },
  {
    "schema_version": "1.2.0",
    "claim_id": "claim:snake_plant:watering:003",
    "plant_id": "plant:snake_plant",
    "plant_name": "Snake Plant",
    "scientific_name": "Dracaena trifasciata",
    "entity_scope": "species",
    "dimension": "watering",
    "qualifiers": {},
    "claim_text": "Avoid overwatering because the roots can rot.",
    "source_id": "ncsu:dracaena-trifasciata",
    "source_title": "Dracaena trifasciata",
    "source_type": "extension",
    "authority_for": [
      "horticultural_care"
    ],
    "locator": {
      "url": "https://plants.ces.ncsu.edu/plants/dracaena-trifasciata/",
      "section": "Description",
      "paragraph": "Description paragraph 2"
    },
    "review_status": "human_verified",
    "accessed_at": "2026-08-12",
    "review_notes": "Created by splitting a season-free rule from claim:snake_plant:watering:001 after human review."
  },
  {
    "schema_version": "1.2.0",
    "claim_id": "claim:snake_plant:soil:001",
    "plant_id": "plant:snake_plant",
    "plant_name": "Snake Plant",
    "scientific_name": "Dracaena trifasciata",
    "entity_scope": "species",
    "dimension": "soil",
    "qualifiers": {},
    "claim_text": "Use well-drained soil.",
    "source_id": "ncsu:dracaena-trifasciata",
    "source_title": "Dracaena trifasciata",
    "source_type": "extension",
    "authority_for": [
      "horticultural_care"
    ],
    "locator": {
      "url": "https://plants.ces.ncsu.edu/plants/dracaena-trifasciata/",
      "section": "Description",
      "paragraph": "Description paragraph 2"
    },
    "review_status": "human_verified",
    "accessed_at": "2026-08-12",
    "review_notes": "Coverage gap identified during human review; human approved."
  },
  {
    "schema_version": "1.2.0",
    "claim_id": "claim:zz_plant:lighting:001",
    "plant_id": "plant:zz_plant",
    "plant_name": "ZZ Plant",
    "scientific_name": "Zamioculcas zamiifolia",
    "entity_scope": "species",
    "dimension": "lighting",
    "qualifiers": {
      "environment": "indoor"
    },
    "claim_text": "ZZ plant tolerates very low light but performs best in bright indirect light; direct sun can scorch foliage.",
    "source_id": "ncsu:zamioculcas-zamiifolia",
    "source_title": "ZZ Plant — Zamioculcas zamiifolia",
    "source_type": "extension",
    "authority_for": [
      "horticultural_care"
    ],
    "locator": {
      "url": "https://plants.ces.ncsu.edu/plants/zamioculcas-zamiifolia/common-name/zz-plant/",
      "section": "Description",
      "paragraph": "Description paragraph 2"
    },
    "review_status": "human_verified",
    "accessed_at": "2026-08-12",
    "review_notes": "Accurate incl. the hedge on scorching. Note: page's structured Light field (Deep shade / Partial Shade = 2-6 hrs direct sun) is landscape-scoped and contradicts this indoor claim — if v2 ingests Cultural Conditions tables, that source needs an environment: landscape qualifier."
  },
  {
    "schema_version": "1.2.0",
    "claim_id": "claim:zz_plant:watering:001",
    "plant_id": "plant:zz_plant",
    "plant_name": "ZZ Plant",
    "scientific_name": "Zamioculcas zamiifolia",
    "entity_scope": "species",
    "dimension": "watering",
    "qualifiers": {
      "season": "summer"
    },
    "claim_text": "In summer, water about twice monthly only after the soil has dried completely.",
    "source_id": "ncsu:zamioculcas-zamiifolia",
    "source_title": "ZZ Plant — Zamioculcas zamiifolia",
    "source_type": "extension",
    "authority_for": [
      "horticultural_care"
    ],
    "locator": {
      "url": "https://plants.ces.ncsu.edu/plants/zamioculcas-zamiifolia/common-name/zz-plant/",
      "section": "Description",
      "paragraph": "Description paragraph 2"
    },
    "review_status": "human_verified",
    "accessed_at": "2026-08-12",
    "review_notes": null
  },
  {
    "schema_version": "1.2.0",
    "claim_id": "claim:zz_plant:watering:002",
    "plant_id": "plant:zz_plant",
    "plant_name": "ZZ Plant",
    "scientific_name": "Zamioculcas zamiifolia",
    "entity_scope": "species",
    "dimension": "watering",
    "qualifiers": {
      "season": "winter"
    },
    "claim_text": "In winter, water at most once a month while the plant is not actively growing.",
    "source_id": "ncsu:zamioculcas-zamiifolia",
    "source_title": "ZZ Plant — Zamioculcas zamiifolia",
    "source_type": "extension",
    "authority_for": [
      "horticultural_care"
    ],
    "locator": {
      "url": "https://plants.ces.ncsu.edu/plants/zamioculcas-zamiifolia/common-name/zz-plant/",
      "section": "Description",
      "paragraph": "Description paragraph 2"
    },
    "review_status": "human_verified",
    "accessed_at": "2026-08-12",
    "review_notes": "Revised after human rejection: changed 'about once a month' to the safer ceiling 'at most once a month'; human re-approved."
  },
  {
    "schema_version": "1.2.0",
    "claim_id": "claim:zz_plant:fertilizer:001",
    "plant_id": "plant:zz_plant",
    "plant_name": "ZZ Plant",
    "scientific_name": "Zamioculcas zamiifolia",
    "entity_scope": "species",
    "dimension": "fertilizer",
    "qualifiers": {},
    "claim_text": "Apply a balanced liquid houseplant fertilizer once or twice per year.",
    "source_id": "ncsu:zamioculcas-zamiifolia",
    "source_title": "ZZ Plant — Zamioculcas zamiifolia",
    "source_type": "extension",
    "authority_for": [
      "horticultural_care"
    ],
    "locator": {
      "url": "https://plants.ces.ncsu.edu/plants/zamioculcas-zamiifolia/common-name/zz-plant/",
      "section": "Description",
      "paragraph": "Description paragraph 2"
    },
    "review_status": "human_verified",
    "accessed_at": "2026-08-12",
    "review_notes": "Frequency matches source exactly. Qualifiers are empty while some indoor care claims use an inferred environment qualifier; decide one qualifier policy after the full review pass."
  },
  {
    "schema_version": "1.2.0",
    "claim_id": "claim:monstera:lighting:001",
    "plant_id": "plant:monstera",
    "plant_name": "Monstera",
    "scientific_name": "Monstera deliciosa",
    "entity_scope": "common_name_mapping",
    "dimension": "lighting",
    "qualifiers": {
      "environment": "indoor"
    },
    "claim_text": "Provide moderate brightness without direct sunlight; variegated cultivars need more light than dark-green cultivars.",
    "source_id": "ncsu:monstera-deliciosa",
    "source_title": "Monstera deliciosa",
    "source_type": "extension",
    "authority_for": [
      "horticultural_care"
    ],
    "locator": {
      "url": "https://plants.ces.ncsu.edu/plants/monstera-deliciosa/",
      "section": "Description",
      "paragraph": "Indoor care paragraph"
    },
    "review_status": "rejected",
    "accessed_at": "2026-08-12",